{
  "$schema": "http://json-schema.org/draft-07/schema#",
  "type": "object",
  "additionalProperties": false,
  "required": [
    "contractVersion",
    "metadata",
    "workload"
  ],
  "properties": {
    "contractVersion": {
      "type": "integer",
      "enum": [
        1
      ]
    },
    "metadata": {
      "type": "object",
      "additionalProperties": false,
      "required": [
        "name",
        "namespace"
      ],
      "properties": {
        "name": {
          "type": "string",
          "minLength": 1,
          "maxLength": 63
        },
        "namespace": {
          "type": "string",
          "minLength": 1,
          "maxLength": 63
        }
      }
    },
    "workload": {
      "type": "object",
      "additionalProperties": false,
      "required": [
        "kind",
        "containers"
      ],
      "properties": {
        "kind": {
          "type": "string",
          "enum": [
            "deployment"
          ]
        },
        "replicas": {
          "type": "integer",
          "minimum": 0
        },
        "containers": {
          "type": "array",
          "items": {
            "type": "object",
            "additionalProperties": false,
            "required": [
              "name",
              "image"
            ],
            "properties": {
              "name": {
                "type": "string"
              },
              "image": {
                "type": "object",
                "additionalProperties": false,
                "required": [
                  "repository",
                  "tag"
                ],
                "properties": {
                  "repository": {
                    "type": "string"
                  },
                  "tag": {
                    "type": "string"
                  }
                }
              },
              "ports": {
                "type": "array",
                "items": {
                  "type": "object",
                  "additionalProperties": false,
                  "required": [
                    "name",
                    "containerPort"
                  ],
                  "properties": {
                    "name": {
                      "type": "string"
                    },
                    "containerPort": {
                      "type": "integer",
                      "minimum": 1,
                      "maximum": 65535
                    }
                  }
                }
              },
              "env": {
                "type": "array",
                "items": {
                  "type": "object",
                  "additionalProperties": false,
                  "required": [
                    "name"
                  ],
                  "properties": {
                    "name": {
                      "type": "string",
                      "description": "DB_HOST is reserved and injected by the platform when database is declared."
                    },
                    "value": {
                      "type": "string"
                    },
                    "secretKeyRef": {
                      "type": "object",
                      "additionalProperties": false,
                      "required": [
                        "name",
                        "key"
                      ],
                      "properties": {
                        "name": {
                          "type": "string"
                        },
                        "key": {
                          "type": "string"
                        }
                      }
                    },
                    "configMapKeyRef": {
                      "type": "object",
                      "additionalProperties": false,
                      "required": [
                        "name",
                        "key"
                      ],
                      "properties": {
                        "name": {
                          "type": "string"
                        },
                        "key": {
                          "type": "string"
                        }
                      }
                    }
                  }
                }
              },
              "envFrom": {
                "type": "array",
                "items": {
                  "type": "object",
                  "additionalProperties": false,
                  "properties": {
                    "configMapRef": {
                      "type": "object",
                      "additionalProperties": false,
                      "required": [
                        "name"
                      ],
                      "properties": {
                        "name": {
                          "type": "string"
                        }
                      }
                    },
                    "secretRef": {
                      "type": "object",
                      "additionalProperties": false,
                      "required": [
                        "name"
                      ],
                      "properties": {
                        "name": {
                          "type": "string"
                        }
                      }
                    }
                  }
                }
              },
              "volumeMounts": {
                "type": "array",
                "items": {
                  "type": "object",
                  "additionalProperties": false,
                  "required": [
                    "name",
                    "mountPath"
                  ],
                  "properties": {
                    "name": {
                      "type": "string"
                    },
                    "mountPath": {
                      "type": "string"
                    },
                    "subPath": {
                      "type": "string"
                    },
                    "readOnly": {
                      "type": "boolean"
                    }
                  }
                }
              }
            }
          }
        },
        "imagePullSecrets": {
          "type": "array",
          "minItems": 1,
          "uniqueItems": true,
          "items": {
            "type": "object",
            "additionalProperties": false,
            "required": [
              "name"
            ],
            "properties": {
              "name": {
                "type": "string",
                "minLength": 1,
                "maxLength": 253,
                "pattern": "^[a-z0-9]([-a-z0-9]*[a-z0-9])?(\\.[a-z0-9]([-a-z0-9]*[a-z0-9])?)*$"
              }
            }
          }
        },
        "volumes": {
          "type": "array",
          "items": {
            "type": "object",
            "additionalProperties": false,
            "required": [
              "name"
            ],
            "properties": {
              "name": {
                "type": "string"
              },
              "configMap": {
                "type": "object",
                "additionalProperties": false,
                "required": [
                  "name"
                ],
                "properties": {
                  "name": {
                    "type": "string"
                  }
                }
              },
              "secret": {
                "type": "object",
                "additionalProperties": false,
                "required": [
                  "secretName"
                ],
                "properties": {
                  "secretName": {
                    "type": "string"
                  }
                }
              }
            }
          }
        },
        "serviceAccountName": {
          "type": "string",
          "minLength": 1,
          "maxLength": 253,
          "pattern": "^[a-z0-9]([-a-z0-9]*[a-z0-9])?(\\.[a-z0-9]([-a-z0-9]*[a-z0-9])?)*$",
          "description": "Existing ServiceAccount in the workload namespace; provisioned separately from this chart."
        }
      }
    },
    "database": {
      "type": "object",
      "description": "Declares a database and injects the platform-managed DB_HOST FQDN into every workload container.",
      "additionalProperties": false,
      "required": [
        "name"
      ],
      "properties": {
        "name": {
          "type": "string"
        },
        "owner": {
          "type": "string"
        }
      }
    },
    "services": {
      "type": "array",
      "items": {
        "type": "object",
        "additionalProperties": false,
        "required": [
          "name",
          "ports"
        ],
        "properties": {
          "name": {
            "type": "string"
          },
          "ports": {
            "type": "array",
            "items": {
              "type": "object",
              "additionalProperties": false,
              "required": [
                "name",
                "port",
                "targetPort"
              ],
              "properties": {
                "name": {
                  "type": "string"
                },
                "port": {
                  "type": "integer",
                  "minimum": 1,
                  "maximum": 65535
                },
                "targetPort": {
                  "type": "string"
                }
              }
            }
          }
        }
      }
    },
    "ingresses": {
      "type": "array",
      "items": {
        "type": "object",
        "additionalProperties": false,
        "required": [
          "name",
          "service",
          "rules",
          "tls"
        ],
        "properties": {
          "name": {
            "type": "string",
            "minLength": 1,
            "maxLength": 63,
            "pattern": "^[a-z0-9]([-a-z0-9]*[a-z0-9])?$"
          },
          "service": {
            "type": "string"
          },
          "rules": {
            "type": "array",
            "items": {
              "type": "object",
              "additionalProperties": false,
              "required": [
                "host",
                "paths"
              ],
              "properties": {
                "host": {
                  "type": "string"
                },
                "paths": {
                  "type": "array",
                  "items": {
                    "type": "object",
                    "additionalProperties": false,
                    "required": [
                      "path",
                      "servicePort"
                    ],
                    "properties": {
                      "path": {
                        "type": "string"
                      },
                      "servicePort": {
                        "type": "string"
                      }
                    }
                  },
                  "minItems": 1
                }
              }
            },
            "minItems": 1
          },
          "tls": {
            "type": "object",
            "additionalProperties": false,
            "properties": {
              "mode": {
                "type": "string",
                "enum": [
                  "cert-manager"
                ]
              }
            },
            "required": [
              "mode"
            ],
            "description": "Required for every ingress. Workloads are HTTPS-only; HTTP requests are redirected by the platform."
          }
        }
      }
    },
    "platform": {
      "type": "object",
      "additionalProperties": false,
      "properties": {
        "database": {
          "type": "object",
          "additionalProperties": false,
          "required": [
            "host"
          ],
          "properties": {
            "host": {
              "type": "string",
              "const": "shared-db-rw.database-system.svc.cluster.local"
            }
          }
        },
        "ingress": {
          "type": "object",
          "additionalProperties": false,
          "properties": {
            "className": {
              "type": "string",
              "const": "traefik"
            }
          }
        },
        "certManager": {
          "type": "object",
          "additionalProperties": false,
          "properties": {
            "issuerRef": {
              "type": "object",
              "additionalProperties": false,
              "required": [
                "name",
                "kind"
              ],
              "properties": {
                "name": {
                  "type": "string"
                },
                "kind": {
                  "type": "string"
                }
              }
            }
          }
        }
      }
    },
    "configMaps": {
      "type": "array",
      "items": {
        "type": "object",
        "additionalProperties": false,
        "required": [
          "name",
          "data"
        ],
        "properties": {
          "name": {
            "type": "string"
          },
          "data": {
            "type": "object",
            "additionalProperties": {
              "type": "string"
            }
          }
        }
      }
    }
  }
}
