{
  "contractVersion": 1,
  "metadata": {
    "name": "deploy-api",
    "namespace": "deploy-api"
  },
  "workload": {
    "kind": "deployment",
    "replicas": 1,
    "containers": [
      {
        "name": "app",
        "image": {
          "repository": "registry.homelab.robinjoon.xyz/apps/deploy-api",
          "tag": "sha-b8b2920d26b4d6ecdb37303047b50a1ca889231a-run-40195559850-1"
        },
        "ports": [
          {
            "name": "http",
            "containerPort": 8080
          }
        ],
        "env": [
          {
            "name": "DEPLOY_API_BASE_URL",
            "value": "https://deploy.homelab.robinjoon.xyz"
          }
        ]
      }
    ],
    "imagePullSecrets": [
      {
        "name": "registry-credentials"
      }
    ]
  },
  "services": [
    {
      "name": "web",
      "ports": [
        {
          "name": "http",
          "port": 80,
          "targetPort": "http"
        }
      ]
    }
  ],
  "ingresses": [
    {
      "name": "public",
      "service": "web",
      "rules": [
        {
          "host": "deploy.homelab.robinjoon.xyz",
          "paths": [
            {
              "path": "/",
              "servicePort": "http"
            }
          ]
        }
      ],
      "tls": {
        "mode": "cert-manager"
      }
    }
  ]
}
